#TRACK_CODE,#RJ-CODE,#CV_IDS,#TAG_IDS,#SERIES_IDS,#ENG-NAME,#JAP-NAME,#THUMBNAIL,#IMAGES,#AUDIOS,#ADDITIONAL_URLS
19178,RJ276886,"1","1-2-7-3-6-4-8-9-5","1","Ripe Woman 12: Another Friend’s Mother","熟れた女12:友だちのお母さん 2人目","4->276886.jpg","255->熟れた女12wall02.jpg","256->熟れた女12_SE01.m4a/200->熟れた女12_SE02.wav/200->熟れた女12_SE03.wav",""
51602,RJ332705,"2","10-11-12-2-13-14","","While You Sleep, You Tsundere Visits You in Bed","寝ている間にツンデレ彼女に夜這いされちゃう音声_英語版","4->332705.jpg","201->special.png/201->special2.png","90->01_W-welcome home. You've overdone it today too, haven't you.wav/90->02_I will kiss you.OK(kissing).wav/90->03_If I lick your ears, you may get up.(Ear Licking).wav/90->04_I.. Probably.. Can't hold back anymore.(Pussy Licking and Masturbation).wav/90->05_Ahh, you’re awake Good morning..wav/90->06_bonustrack_Sleeping breath track.wav",""
48817,RJ319007,"2","1-2-7-15-17-18-16-5","","Pure Love Pussy Therapy ~ A Pussy Therapist Will Relieve That Unfulfilled Feeling ♪~","純愛おまんこセラピー ～その満たされなさ、おまんこセラピストが解消します♪～","4->319007.jpg","154->2.純愛おまんこセラピー(ロゴなし).jpg/154->3.純愛おまんこセラピー_ラフ.jpg/154->4.純愛おまんこセラピー_抱きつきラフ.jpg/154->5.純愛おまんこセラピー_サムネイル画像.jpg","35->1.おまんこセラピーへようこそ♪.wav/35->2.ばぶばぶホールディング♪.wav/35->3.純愛おちんぽセラピー♪.wav/35->4.純愛おまんこセラピー♪.wav/35->5.純愛ばぶばぶセラピー♪.wav/35->6.安眠おまんこセラピー.wav/35->7-1.純愛おちんぽじゅぼじゅぼ♪.wav/35->7-2.純愛耳かきセラピー♪.wav",""
75923,RJ01024994,"3","10-1-11-15-17-19-23-25-22-20-21-24","","Downer Menhera JK and Oho Voice Addict’s Depraved Life Together","【3月12日までドスケベ特典付き】ダウナー系メンヘラJKとオホ声依存共堕落生活","4->1024994.jpg","257->制服.jpg/258->全裸.jpg","55->効果音あり_トラック１.wav/55->効果音あり_トラック２.wav/55->効果音あり_トラック３.wav/55->効果音あり_トラック４.wav/55->効果音あり_トラック５.wav/55->効果音あり_トラック６.wav/55->効果音あり_トラック７.wav",""
56829,RJ223101,"2","1-2-17-26-20-21-27-28-16","","Blonde’s Angel Temptation～","金髪天使の誘惑～","4->223101.jpg","202->Without logo Main jacket (with tights).jpg/202->Without logo Main jacket (without tights).jpg","56->02.Please touch gently tits.mp3/56->03.Does my blowjob feel good?.mp3/56->04.Shave pubic hair.mp3/56->05.Even more blowjob.mp3/56->06.Put your cock in me.mp3/56->07.I want to have more sex.mp3/56->Bonus track.Professor Julia's Special English Lesson.mp3",""
78568,RJ01051259,"2","29-7-8-30","2","Gravure Idol vs Hero ~ Controlled Masturbation, Tantalizing Nipple Play, and Breast Fucking with Explosive Titjob Cumshots to Make You Their Obedient Slave~","グラドルvsヒーロー～操られオナニー・カリカリ乳首責め・爆乳パイズリ乳内射精攻撃で言いなり奴隷～","4->1051259.jpg","203->グラドル（水着あり）.jpg/203->グラドル（水着なし）.jpg","259->本編.wav",""
51046,RJ332593,"4-5","7-32-33-31-34-30","3","Audio of Tennis Club Girls Teasing Both Nipples from Both Sides to Develop a Habit of Losing in Climax from Defeat","テニス部の女の子達に両サイドから乳首を責められて、敗北絶頂の負け癖をつけられる音声","4->332593.jpg","260->紹介画像（文字なし）.jpg/204->おまけ動画.mp4","204->本編.wav",""
78560,RJ01047483,"6","29-1-35-11-36-17-18-25-37-38-39-9-40-44-16-41-42-43-5","","In the futon soaked in the thick female smell of a vulgar downer succubus, super close contact and thick voice sex","下品なダウナーサキュバスの濃厚なメス臭が染み込んだ布団の中で超密着濃厚オホ声えっち","4->1047483.jpg","261->パッケージイラスト(ロゴ無し).png","155->01.プロローグ.wav/179->02.汗だくの肉布団に抱きつかれて耳舐め尻尾コキ.m4a/179->03.ぬるぬるでムチムチの肉厚太ももコキ.m4a/155->04.濃厚なメス臭が染み込んだ布団の中で超密着濃厚オホ声えっち.wav/179->05.下品なお口まんこでねっとりフェラチオ.m4a/155->06.臭すぎる布団の中で性処理肉オナホの嫁と超密着濃厚オホ声えっち.wav/155->07.エピローグ.wav",""
67197,RJ388694,"7","1-45-11-46-15-17-18-47-37-22-48-27-40-44-16-41-42-5","4","Lovey-dovey sex with a lewd senior girlfriend ~I’ll suck your semen, chuchu drain~","淫魔な先輩彼女とイチャラブセックス～君の精液吸うよチュウチュウドレイン～","4->388694.jpg","262->パッケージイラスト　ロゴなしver.jpg","36->① 告白の季節.wav/36->② 淫魔なお姉ちゃん.wav/36->③ 左耳もチェック♪.wav/36->④ 優奈ママと赤ちゃん.wav/36->⑤ お姉ちゃんの尻尾オナホ.wav/36->⑥ 図書室ではお静かに.wav/36->⑦ お姉ちゃんのお願い.wav/36->⑧ お姉ちゃんとイチャラブセックス.wav",""
35998,RJ306372,"8","49-50-1-15-17-51-20-16-52","5","Crazed Gal’s 0 Yen Pussy","メンヘラギャルの0円おまんことの性活【フォーリーサウンド】","4->306372.jpg","263->メンヘラギャル高画質パッケージ.jpg","205->#1.駅前公衆トイレでメンヘラギャルのフェラはいかがですか?.m4a/205->#2.家に来て即ハメセックスサービス.m4a/19->#3.お風呂場手こきえっち.wav/19->#4.お風呂場セックス.wav/19->#5.リビング入って速攻で立ちバックえっち.wav/19->#6.ご飯食べながらフェラ.wav/19->#7.エンドレスセックス.wav/19->#8.添い寝.wav/19->#9.寝起きフェラ.wav/19->#10.寝起きセックス.wav/19->#11.危険日の満喫カップルシートセックス.wav/19->#12.漫画喫茶アナルセックス.wav/19->#13.お家でアナルセックス.wav",""
75549,RJ01013493,"9-8","29-1-53-45-11-7-15-32-17-18-54-55-20-9-16-56","","Tomboyish girl and Gal girl are too familiar with each other!","ボーイッシュ女とギャル女が馴れ馴れしいっ!【マゾ系おねショタのドスケベ性行為】","4->1013493.jpg","264->超高画質ジャケットイラスト(ロゴ無し).jpg","57->01.ボーイッシュ女とギャル女がやってきた！.wav/57->02.ゆう姉ちゃんの皮むきレッスンとびゅるびゅる精通おもらし.wav/57->03.れい姉ちゃんの乳首責めじゅぼじゅぼフェラチオ.wav/57->04.密着おっぱい誘惑とあまあまオナニー指導.wav/57->05.れい姉ちゃんの赤ちゃんごっこ授乳手コキ.wav/57->06.ゆう姉ちゃんの童貞卒業中出しぴゅっぴゅ.wav/57->07.れい姉ちゃんのラブラブわんちゃん交尾.wav",""
41099,RJ316856,"9","49-1-15-17-57-20-16","5","Give your rich semen to erotic gal JK’s lewd damman!!","エロギャルJKのドスケベタダマンにあなたの濃厚ザーメンを!!【フォーリーサウンド】","4->316856.jpg","265->エロギャルJK高画質パッケージ.jpg","24->#1.駅前公衆トイレでふぇら抜きサービス.wav/206->#2.家に来て即ハメゴムありえちえち.m4a/24->#3.お風呂場でしこしこえっち.wav/24->#4.お風呂場セックス.wav/24->#5.仕事終わりのお出迎え立ちバックえっち.wav/24->#6.ご飯食べながらフェラ.wav/206->#7.エンドレスセックス.m4a/24->#8.添い寝.wav/24->#9.寝起きフェラ.wav/24->#10.寝起きセックス.wav/24->#11.外で内緒のセックス.wav/24->#12.外で内緒のアナルセックス.wav",""
72371,RJ437091,"9","49-1-58-15-17-8-55-20-16","5","All the semen you can get on the erotic girl JK","エロギャルJKのドスケベタダマンにありったけのザーメンを【フォーリーサウンド】","4->437091.jpg","266->高画質パッケージ.jpg","37->#1.公園でギャルＪＫと意気投合！.wav/37->#2.ののかのからかい快感手コキ.wav/37->#3.ののかのからかいごっくんフェラ.wav/37->#4.ののかのふわふわパイズリフェラ.wav/37->#5.ののかの上乗り絶頂素股.wav/37->#6.ののかと童貞卒業生えっち.wav/37->#7.ののかの足コキカウントダウン.wav/37->#8,ののかの絶頂アナルえっち.wav",""
45123,RJ315439,"10","10-45-11-32-59-34-61-16-5-60","6","Step-sisters giving you a raw fuck with lots of kisses and love","まっすぐに好意を寄せてくる義妹がキスと愛情たっぷりに生ハメ交尾してくれる音声","4->315439.jpg","207->01.パッケージイラスト（1920x1440）.png/207->02.パッケージイラスト差分（1920x1440）.png","58->01.綾との日常.mp3/58->02.優里の日常.mp3/58->03.優里の想い.mp3/58->04.二人のご奉仕.mp3/58->05.優里と.mp3/58->06.綾と.mp3/58->07.おやすみなさい.mp3",""
76230,RJ430773,"11","10-29-1-11-7-46-15-17-18-25-47-37-22-9-44-16-5","","My girlfriend has a super sensitive, super sadistic pussy that orgasms instantly and keeps climaxing and won’t stop","即イキ超敏感ドSおまんこ持ちのえちえち彼女がずっと絶頂しててやめてくれない件","4->430773.jpg","","91->トラック1.wav/91->トラック02.wav/91->トラック03.wav/91->トラック04.wav/91->トラック05.wav/91->トラック06.wav/208->即イキ彼女特典音声1.wav/208->即イキ彼女特典音声2.wav",""
74842,RJ01022104,"6","10-49-17-62-25-40-63-5","","Little bitch vampire ♪ Continuous vaginal cum shot with a cock erected by a female brat’s whispering voice","りとるびっちヴァンパイア♪ メスガキの囁きオホ声で勃起したチンポでぷにろりま〇こに連続中出し【KU100ハイレゾ】","4->1022104.jpg","156->1920×1080A.jpg/156->1920×1080B.jpg/156->1920×1200A.jpg/156->1920×1200B.jpg/209->スマホ縦B.jpg/209->スマホ縦A.jpg","133->【Track01】コスプレロリっ娘とお風呂♪.wav/133->【Track02】メスガキの焦らし射精管理♪.wav/133->【Track03】メスガキまんこに中出し三連発♪.wav/267->【Track04】分身メスガキと3Pえっち♪.m4a/133->【Track05】快楽堕ちちんぽおねだり♪.wav/133->【Track06】涼花みなせさんフリートーク♪.wav",""
71789,RJ432880,"12","45-11-7-31-25-38-64-9-61-65","","Mean Twins Endless Overkill Ejaculation Endurance Hell","【寸止め3時間超】意地悪な双子の終わらないオーバーキル射精我慢地獄【KU100】","4->432880.jpg","210->01_パッケージ.jpg/210->02_特典.jpg","180->1_おはよう、お兄さま.wav/180->2_準備体操.wav/157->3_射精我慢ゲーム.m4a/157->4_続＿射精我慢ゲーム.m4a/157->5_終わらない我慢汁搾り.m4a/180->6_地獄のカウントダウン.wav/157->7_敗北お漏らし（通常盤）.m4a",""
70249,RJ418151,"3","29-11-15-17-25-20-21-16-5","","Dirty stuffy stuffy huge breasted JK’s super close-fitting and snuggly sleep-sharing sex","【10月21日まで期間限定イラスト付き】ドスケベ蒸れ蒸れ爆乳JKの超密着ぬくぬく寝かしつけ添い寝えっち【超密着×添い寝×低音】","4->418151.jpg","211->ラムネ屋６月分着色_着衣.jpg/211->ラムネ屋６月分着色_全裸.jpg","92->1章ドスケベ蒸れ蒸れ爆乳JKの超密着ぬくぬく寝かしつけ添い寝えっち.wav/92->2章　眠れぬあなたに爆乳低音JKの耳舐め密着添い寝（添い寝　耳舐め、耳攻め　囁き）　.wav/268->3章　おっぱい押し当て乳首責め耳舐め手コキ（おっぱい押し当て、乳首責め、耳舐め、手コキ、囁き）.m4a/92->4章　好き好き囁き、耳舐めキス（甘々、好き囁き、耳舐め、Dキス）.wav/92->5章　蒸し蒸し布団の中で汗だく交尾with囁き耳舐め（ムレムレ交尾、中出し、Dキス、）.wav/92->6章　全肯定甘やかし安眠寝かしつけ（寝かしつけ、甘やかし、囁き）.wav/92->7章　お布団の中で寝起きの幸せモーニング交尾（中出し交尾、キス、囁き、）.wav",""
76778,RJ01035824,"2","10-51-20-28-5","","The student council president of the honor student who everyone envy is my wife.","【先生とMプレイ】誰もが羨む優等生の生徒会長が俺の嫁。清純そうな顔を歪ませて今夜も俺にマゾメスご奉仕セックスする","4->1035824.jpg","212->マゾ嫁JK01.png/212->マゾ嫁JK02.png","38->track00 「タイトルコール」.wav/38->track01 「生徒会長柏木詩暮の裏の顔」.wav/38->track02 「先生にオシオキして欲しくて、強い言い方になりましたぁ♥」.wav/38->track03 「はぁ…あぁ…先生のおちんぽ、早くハメハメしてくださぁい♥」.wav/38->track04 「先生のご指導、思い出して疼いてきましたぁ♥」.wav/38->track05 「先生？どうかされましたか？」.wav/38->track06「先生が詩暮に嫉妬してくれるって思っただけでっ…♥」.wav/38->track07 「私のことを好きな男子の見ながら犯されてるっ…♥♥」.wav",""
51491,RJ332227,"13","29-45-11-17-18-44-16","","Cum Insurance Lady Kindly Gets You Off","クールに甘ヌキしてくれる“射精保険”のお姉さん【バイノーラル】","4->332227.jpg","269->イメージイラスト.jpg","59->0.プロローグ.wav/59->1.『最初は“お口”で補助させていただきます』.wav/59->2.『オナホールにて補助させていただきます』.wav/59->3.『お客様に、して差し上げたいことがあります』.wav/59->4.『“童貞特約”の適用となりました』.wav/59->5.『改めまして……“恋人特約”の適用をさせていただきます』.wav/59->6.おまけ『本日は、“キス特約”の適用となります』.wav",""
76192,RJ01032881,"14","10-49-29-1-11-66-15-17-18-25-22-55-20-21","","After School Implantation Committee Your Only Oma ○ Cock Milk Is Overflowing From Here And You Can’t Stop Crying ♪","放課後着床委員会 キミだけのおま○こからちんぽミルクがびゅるびゅる溢れてオホ声が止まらないの♪【KU100ハイレゾ】","4->1032881.jpg","158->メインビジュアルB（ロゴなし）.jpg/158->メインビジュアルA（ロゴなし）.jpg/158->メインビジュアルB【メガネ】（ロゴなし）.jpg/158->メインビジュアルA【メガネ】（ロゴなし）.jpg/39->スマホ横B.jpg/39->スマホ横A.jpg/39->スマホ横B【メガネ】.jpg/39->スマホ横A【メガネ】.jpg/39->スマホ縦B.jpg/39->スマホ縦A.jpg/39->スマホ縦B【メガネ】.jpg/39->スマホ縦A【メガネ】.jpg/213->ちびキャラ_円.jpg/213->ちびキャラ_円【メガネ】.jpg","93->【Track01】射精したがってるの伝わってくるよ….wav/93->【Track02】これぇ無理やりイカされるセックスぅ….wav/93->【Track03】おまんこ発情させてメスにさせてぇ….wav/93->【Track04】おまんこ孕む準備はじめちゃってるぅ….wav/93->【Track05】アナルされるの気持ちよすぎぃ….wav/93->【Track06】高梨はなみさんフリートーク♪.wav",""
72373,RJ437151,"15","10-29-1-53-68-11-15-17-18-67-69-44-42-5","7","Adaruto Broadcasting Station～Pampering with Aya-nee’s Omako～","【超密着耳元吐息】あだると放送局～綾姉のおま〇こで甘やかし寝かし付け編～","4->437151.jpg","60->おまけ04_綾姉ジャケットイラスト.jpg","181->20xx年10月3日1_寝かし付けおま〇こ配信.m4a/60->20xx年10月3日2_精液入れたままピロートーク配信.wav/60->20xx年10月17日1_イかされたら負け♪おま〇こマッサージ配信.wav/60->20xx年10月17日2_罰ゲーム、限界まで絞られる寝かし付け配信.wav/181->20xx年12月5日_おま〇こに何を挿入したか音当てクイズ配信.m4a/181->20xx年12月7日_お昼休みにお昼寝させる配信.m4a/60->おまけ01_耳舐め+生ハメで連続絶頂.wav/60->おまけ02_ベロチュー+生ハメで連続絶頂.wav/60->おまけ03_おっぱいぎゅ♪からの69の体制で反省会.wav",""
78704,RJ01049698,"16-17","70-29-71-72-38-69-16-14","","Permanent 100 Yen! Masturbating after school together ~Sakura and Mei~","永久100円!【ガチレズ!】放課後ふたりっきりでオナニー～サクラと芽衣〜","4->1049698.jpg","270->さくらとめい特典用.png","271->完ガチレズ１話さくらとめい.m4a",""
53134,RJ336256,"18","10-53-45-68-11-7-15-74-18-75-76-61-42-65-73-5","","Gravure Idol Sisters’ Reverse NTR Virgin-Corruption","ドスケベグラドル姉妹の逆寝取られ童貞いじめ邪悪好意マゾ堕とし","4->336256.jpg","20->表紙（タイトルロゴ無し）.jpg","20->1　プロローグ編.mp3/20->2　囁き手コキ編.mp3/20->3　彼女からのメール編.mp3/20->4　グラビアオナニー見学編.mp3/20->5　オナホ編.mp3/20->6　ベロチュー素股編.mp3/20->7　ベロチューサンド編.mp3/20->番外編　「イケ」＆「イクな」囁き編.mp3/20->番外編　匂い責め嘘喘ぎオナてつ編.mp3/20->番外編　ダブル鼻息耳舐め編.mp3",""
57648,RJ362188,"19","29-35-45-11-15-17-18-54-8-77-16-78","8","Getting Married and Making Babies with an Aloof Princess","“クールな”お姫様と結婚して、オナホおまんこでイチャラブ子作りえっちが仕事になる生活♪【バイノーラル】","4->362188.jpg","272->イメージイラスト.jpg","61->0.プロローグ.wav/61->1.『では、子作りオナホえっちをお願いします』.wav/61->2.『わたくしをオナホとして見ていただく練習をしましょう』.wav/61->3.『何かお礼をさせていただけませんか？』.wav/61->4.『お詫びに、何かオナホご奉仕はいかがでしょうか？』.wav/61->5.『では、ラブハメ結婚おまんこをしましょう』.wav/61->6.おまけ『耳元で淫語を囁きます』.wav",""
32791,RJ299164,"4","29-45-11-15-17-18-54-77-16-78","8","Marry the Princess, and Start Your Job as a Baby-maker","お姫様と結婚してオナホおまんこでイチャラブ子作りえっちが仕事になる生活♪【バイノーラル】","4->299164.jpg","273->イメージイラスト.jpg","62->0.プロローグ.mp3/62->1.『子作り、しましょうか♪』.mp3/62->2.『飽きないように、違うやり方のほうがいいですよね♪』.mp3/62->3.『わたくしの体、いつでもオナホにしてくださいね♪』.mp3/62->4.『あまぁ～い休憩、しましょっか♪』.mp3/62->5.『も～っとイチャラブな子作り、しましょうね♪』.mp3/62->6.おまけ『えっちな言葉、たくさん言っちゃいますね♪』.mp3",""
75401,RJ438225,"2","79-10-49-29-1-71-11-58-81-25-80-27-5","","That Gallant Girl Gets Brainhack Corrupted Into A Cumdump Sex Slave","気になるあの子を、常識改変で肉奴隷に堕とす","4->438225.jpg","214->N3m.jpg/214->hkmgkm2.png/94->1_export.mp4/94->2_export.mp4/94->3_export.mp4/94->4_export.mp4/94->5_export.mp4/94->6_export.mp4","95->01. プロローグ.wav/95->02. 常識改変耳舐め足コキ.wav/95->03. アナル拡張報告+キスしながら手マン.wav/95->04. オホ声アナルハメハメセックス.wav/95->05. 本番セックスで耳舐めオナホ奴隷堕ち.wav/95->06. 完全堕ちイチャラブセックス.wav",""
71765,RJ427661,"20","49-29-1-82-17-25-51-16","9","The story of how the goddess came out when I dropped the Masturbator into the pond and rewarded me as an honest person ~","お池のオナホ女神様 ～オナホを池に落としたら女神様が出てきて正直者の俺にご褒美くれた話～","4->427661.jpg","215->メインパッケージ（文字無し）.png/215->メインパッケージ差分（文字無し）.png","134->トラック1_オナホを池に落としただけなのに（効果音有り）.wav/134->トラック2_オナホとパイズリとフェラチオと（効果音有り）.wav/134->トラック3_オナホに勝る女神様の超絶まんこ（効果音有り）.wav/134->トラック4_オナホと化するアナルで悶絶SEX（効果音有り）.wav/134->トラック5_オナホの女神様また会いましょう（効果音有り）.wav",""
53993,RJ338130,"2","10-49-1-11-15-83-17-22-84-85","","Emergency Fertilization Declaration!! Big brother! I want the vaccine to be released quickly!","緊急受精宣言!! お兄ちゃん! ワクチン早くナカに出してぇ♪","4->338130.jpg","216->メインビジュアルB（ロゴなし）.jpg/216->メインビジュアルA（ロゴなし）.jpg/159->1920×1080B.jpg/159->1920×1080A.jpg/159->1920×1200B.jpg/159->1920×1200A.jpg/160->スマホ横B.jpg/160->スマホ横A.jpg/160->スマホ縦B.jpg/160->スマホ縦A.jpg/274->ちびキャラ_ありさ.jpg","135->Track01_緊急受精宣言が発出されました♪.wav/135->Track02_ありさの耳舐め、手コキ、フェラ♪.wav/135->Track03_ありさに首絞めアナルセックス♪.wav/275->Track04_ありさに生ハメ中出しセックス♪.m4a/135->Track05_ありさのあまらぶ耳かき♪.wav/135->Track06_逢坂成美さんフリートーク♪.wav",""
77015,RJ01035581,"21","1-86-87-11-17-18-69","","Get your cheating wife back and teach her a lesson","寝取られた不倫妻を取り戻してわからせキメセク","4->1035581.jpg","217->NTRわからせ_ロゴ無し.jpg/217->NTRわからせ_正方形.jpg","161->01.面倒くさそうな夫婦の日常セックス.wav/161->02.憧れの上司と不倫の始まり.wav/161->03.夫婦の寝室で不倫エッチ.wav/161->04.夫婦でイチャラブキメキメ交尾.wav/276->05.薬漬けでわからせ続けた結果…キメセクの末路.m4a",""
76368,RJ01025198,"22","29-1-86-11-15-17-18-72-25-22-76-20-69","","While my wife was away, I had sex with my wife’s cute little sister for two days straight","妻が不在の間に嫁のあざと可愛い妹JKとずっと密着中出し生ハメまくる2日間【オホ声】","4->1025198.jpg","40->嫁のあざと可愛い妹JK１.jpg","40->1.びしょ濡れのJKがいきなり訪問.wav/40->2.停電がくれたハプニング？.wav/40->3,暗闇で聞こえるのはくちょくちょの音？.wav/40->4.小悪魔JKの本領発揮.wav/40->5.ベランダで秘密の？立ちバック.wav/40->6.朝起きたら裸エプロンJK.wav/277->特典①24分間耳舐めされながらディープキスして一線超えちゃう音声（手コキ、フェラ、えっち）.m4a/40->特典②12分間耳舐めされながら生ハメハメしまくる音声.wav",""
73353,RJ01008483,"22","29-1-86-11-15-17-72-6-88-67-25-37-22-69-30","","Married Woman Miss Menes’ Soggy Kneading Treatment ~ Best Friend’s Wife’s Vulgar Back Ohiki Course 90 Minutes ~","人妻メンエス嬢のねっとりこねくり寸止め施術〜親友妻の下品に貪る裏オホイキコース90分〜","4->1008483.jpg","63->素材.jpg","63->１，メンエス行ったら親友の妻登場？！.wav/63->２，お客様にNG行為のご案内.wav/63->３，おちんぽこねくり寸止め焦らし？.wav/63->４，おちんぽ汁で興奮メンエス人妻嬢♡.wav/63->５，あなただけのメンエス裏コース♡.wav/63->６，親友妻の延長絶頂オホイキ.wav/218->特典①25分間人妻メンエス嬢に手コキされながら耳、乳首、アナルありとあらゆるところを舐められ寸止からのフェラでイかされる音声.m4a/218->特典②23分間親友の妻におちんぽをこねくりまわされ騎乗位、バックからのオホ声で中出しおま◯こされ続ける音声.m4a",""
73273,RJ01007071,"23","29-1-89-11-3-17-6-25-8-90","","I can’t believe a married cheerleader who blames me makes such a vulgar voice...","俺を責めてくれる人妻チアガールがあんな下品なオホ声出すなんて…【ハニトラ注意】","4->1007071.jpg","278->人妻チアガール_高画質イラスト.jpg","219->トラック１：プロローグ.wav/219->トラック２：美遊さんの甘い誘惑.wav/136->トラック３：マゾいじり騎乗位セックス.m4a/136->トラック４：Ｍ調教亀頭責め！.m4a/136->トラック５：秘密のお漏らし＆射精.m4a/136->トラック６：試合よりエッチのほうがいいよね？.m4a/136->トラック７：ネタばらし！見せつけ本気セックス！.m4a",""
38876,RJ310861,"6","29-89-45-15-72-54-59-51-90-38-55-20-28","10","Perverted pervert club activity of perverted cheerleader girl♪ ~Neat and clean school idol was perverted and the lowest exhibitionist♪~","ドスケベチアガールのエロエロ変態部活動♪～清楚な学園のアイドルはド変態で最っ低な露出狂でした♪～","4->310861.jpg","182->パッケージイラスト_ロゴなし.jpg/182->Exイラスト_01.png/182->Exイラスト_02.png","137->(1)ドスケベチアガールの正体…♪.wav/137->(2)部室で変態同士のオナニー見せあいっこ♪ドスケベチアリーディング練習♪.wav/137->(3)部員に隠れてバレないように背徳密着耳舐め♪JKの匂い、吐息、肌の感触をオカズに淫乱手コキで昇天♪.wav/137->(4)全校生徒に屋上から見せつける、バック本気レイプ♪寝取り種付け最低エロエロセックス♪.wav/137->(5)学校近くの公園でド変態野外露出プレイ♪触りあいセックスごっこで気持ちよすぎて野良犬みたいな放尿絶頂♪.wav",""
