#TRACK_CODE,#RJ-CODE,#CV_IDS,#TAG_IDS,#SERIES_IDS,#ENG-NAME,#JAP-NAME,#THUMBNAIL,#IMAGES,#AUDIOS,#ADDITIONAL_URLS
114278,RJ01180012,"3","49-29-1-117","","~A dark past and a mentally unstable saint who frequents the area for intimate sex~ {Pure love and loose sex that will make you fall asleep♪}","【無気力ダウナー】～暗い過去があるメンヘラ聖女の入り浸り密着性交～《純愛ゆるオホえっちでシコ寝必至♪》","1->114278-0.jpg","1->114278-1.jpg/1->114278-2.jpg","2->114278t1.mp3",""
117026,RJ01192535,"3","29-1-35-11-55-20","","You, the loner I chose as an elite♪ A downer mentally unstable busty JK’s exciting and lewd sexual life♪","【オホ声×ダウナーJK】エリートのボクが選んだぼっちのキミ♪ダウナーメンヘラ爆乳JKのどきどきドスケベ性処理当番性活♪","1->117026-0.jpg","1->117026-1.jpg/1->117026-2.jpg/1->117026-3.jpg/1->117026-4.jpg","2->117026t1.mp3/1->117026freetalk.mp3/1->117026目覚ましアラーム音声.mp3",""
122048,RJ01234695,"3-25","10-49-1-45-15-32-107","17","Yuru Oho Summer: Naked sisters and sweaty summer vacation","【初週限定特典付き】ゆるオホサマー はだか姉妹と汗だくえっち夏休み【全編ゆるオホ】","1->122048-0.jpg","1->122048-1.jpg/1->122048-2.jpg/1->122048-3.jpg/2->122048-4.mp4","2->122048t1.mp3",""
13655,RJ265279,"64-25","92-11-15-32-20-40","98","JK Succubus Cosplayers’ Ear-licking Sex","JKサキュバスレイヤーたちの飼い殺し耳舐めコスハメセックス♪","1->13655-0.jpg","1->13655-1.webp","2->13655t1.mp3",""
125332,RJ01280947,"64-25","10-92-11-32-20-40","98","JK succubus cosplayers’ lovey-dovey harem cohabitation life","JKサキュバスレイヤーたちの飼い殺しラブラブハーレム同棲生活","1->125332-0.jpg","1->125332-1.jpg/1->125332-2.jpg/1->125332-3.jpg/1->125332-4.jpg","2->125332t1.mp3/1->125332omake.mp3",""
125143,RJ01269578,"48","1-87-31-40-43","99","I’m exhausted from working at a black company, and a succubus comes to live with me and milks me for a sweet, semen-squeezing sex life♪","早期限定40%OFF【♦️チンカス大好き悪戯っ子〇リ処女サキュバス♦️】ブラック会社勤務でヘトヘトのボクと〇リ淫魔の押し掛け同棲甘ハメ搾精性活♪","1->125143-0.jpg","1->125143-1.jpg/1->125143-2.jpg","2->125143t1.mp3",""
124570,RJ01258434,"140","10-29-1-87-3-22","100","Obedient affair hot spring 2 ~ Brain orgasm, submissive submissive, 1 night 2 day cuckoo egg NTR baby making trip ~","期間限定30%OFF!いいなり不倫温泉2～脳イキ ドM媚び媚び1泊2日托卵NTR子作り旅行～【KU100】","1->124570-0.jpg","1->124570-1.jpg","2->124570t1.mp3",""
124143,RJ01142308,"25","10-29-1-45-15-33-37-22-20","","A story about monopolizing a pure and lewd junior college girl and having sweet breeding sex at a love hotel","清楚系ドスケベ後輩女子大生を独り占めしてラブホで甘々繁殖交尾する話","1->124143-0.jpg","1->124143-1.jpg","2->124143t1.mp3",""
123906,RJ01258294,"48","1-87-31-20-40","","Cheeky succubus J◯ is teased at a school festival soapland and reaches climax Ohoakume","【○リオホ×わからせ】生意気サキュバスJ◯を学祭ソープでわからせ絶頂オホアクメ","1->123906-0.jpg","1->123906-1.jpg/1->123906-2.jpg/1->123906-3.jpg/1->123906-4.jpg/1->123906-5.jpg/1->123906-6.jpg","2->123906t1.mp3/1->123906freetalk.mp3",""
124872,RJ01263711,"141","29-1-11-62-8","","Masochistic male premature ejaculation rehabilitation clinic ~ Low-pitched, expressionless nurse’s businesslike ejaculation management treatment ~","マゾオス専門早漏リハビリクリニック〜低音無表情ナースの事務的射精管理治療〜","1->124872-0.jpg","1->124872-1.jpg","2->124872t1.mp3/2->124872tokuten.mp3",""
120172,RJ01226338,"142","70-136-90-64-20-21-43","","The girl I like is stuck in the wall and I can only watch as she is raped by a classmate","壁にハマった好きな子がクラスメイトに犯されているのを僕はただ見ている事しかできなかった【壁尻ワールド】","1->120172-0.jpg","1->120172-1.webp/1->120172-2.webp/1->120172-3.webp","2->120172t1.mp3",""
125140,RJ01265815,"6-3","29-47-34-30","","Nipple Beats! ~You won’t be able to stop moving to the sound! The development of a new nipple sensation that will make your knees tremble and your mouth drool!!~","【かんたん乳首開発】乳首ビーツ!～音に合わせて「ぜったいに」手が止められない!ガクガク膝が震えてよだれを垂れ流す新感覚の乳首開発!!～","1->125140-0.jpg","1->125140-1.jpg","2->125140t1.mp3",""
125298,RJ01272471,"24-6","10-49-29-92-11-91-3-34","27","Halloween Cuckolding of a Married Woman♪ Cosplay Married Woman and Creampie Sweet Oho Night♪","【どすけべ甘オホ】人妻寝ッ取リHalloween♪ コスプレ人妻んこと中出し甘オホNight♪【KU100ハイレゾ】","1->125298-0.jpg","1->125298-1.jpg/1->125298-2.jpg/1->125298-3.jpg/1->125298-4.jpg","2->125298t1.mp3/1->125298freetalk.mp3",""
126876,RJ01299406,"143","10-49-29-45-36-13","","The ideal girlfriend with a voluptuous body who will fulfill all your desires~","【対魔忍RPGX】鬼崎きららASMR～豊満ボディで欲求を全部叶えてくれるツンデレで理想の彼女～","8->126876-0.jpg","8->126876-1.jpg","9->126876t1.mp3/8->126876tokuten.mp3",""
110350,RJ01154500,"144","10-29-1-131-45-62","","Meticulous care ~ Intimate diagnosis and treatment from top to bottom by nurse girlfriend Aoi♪","無微不至的呵護～護士女友Aoi由上而下的親密診療♪【KU100高音質】","8->110350-0.jpg","8->110350-1.jpg/8->110350-2.jpg","9->110350t1.mp3",""
121093,RJ01171577,"5","10-29-11-7-40","61","Succubus Nursery School ～Only Masochists Can Enter. Lewd Orgasms Managed While Being Tortured in Baby Talk～","ドMしか入園できないサキュバス保育園 ～赤ちゃん言葉で責められながらドスケベ絶頂管理～","8->121093-0.jpg","8->121093-1.jpg","9->121093t1.mp3",""
117342,RJ01184547,"31","1-108-59-47-144","","When I exercise, my female juices start to overflow, and I have sex with a carnivorous, lewd instructor who moans and sweats.","運動するとメス汁が溢れ出してきちゃう肉食ドスケベインストラクターお姉さんとオホ声汗だくムレムレ生セックス♪【KU100】","8->117342-0.jpg","8->117342-2.jpg/8->117342-3.jpg","9->117342t1.mp3",""
123780,RJ01215824,"49","70-29-35-4-110-38-22","","Until the educational mom becomes her son’s friend’s female onahole. The pleasure training of a cuckold mom","教育ママが息子の友達の雌オナホになるまで。寝取られママの快楽躾け【ドS向け】【KU100】","8->123780-0.jpg","8->123780-1.webp/8->123780-2.webp","9->123780t1.mp3",""
126489,RJ01292503,"3","10-1-45-36-74-33-20","12","A story about a junior JK gravure idol who serves a dirty dick with smegma♡","12/2まで限定4大特典!後輩JKグラビアアイドルがチンカス汚ちんぽに媚び媚びご奉仕してくれるお話♡【KU100】","8->126489-0.jpg","8->126489-1.jpg/8->126489-2.jpg","9->126489t1.mp3/8->126489freetalk.mp3/8->126489tokuten.mp3",""
115542,RJ01182574,"6","109-49-104-53-11-36-46-91-32-25-34-38-76-61-16-65-73-43-24","101","Quan hệ tình dục lười biếng với hai chị em thô tục và luộm thuộm tại nhà","下品でだらしないダウナー姉妹とおうちでだらだらオホ声セックス","4->1182574.jpg","313->パッケージイラスト(ロゴ無し).png","70->01.プロローグ.mp3/70->02.彼女に乳首責めされながら彼女の妹と対面座位.mp3/70->03.ムチムチで汗臭い彼女と愛を深め合うオホ声セックス.mp3/70->04.メス臭い布団の中で吐息たっぷり両耳舐め手コキ.mp3/70->05.ムレムレで汗臭い彼女の妹と愛に満ち溢れたオホ声セックス.mp3/70->06.彼女の妹に乳首責めされながら彼女と対面座位.mp3/70->07.エピローグ.mp3",""
123882,RJ01252224,"6","53-35-36-19-105-25-38-16-43-24","","Cảnh ân ái cực kỳ thân mật, mãnh liệt, đẫm mồ hôi với một cô hầu gái thô tục, ủ rũ trên chiếc giường ẩm ướt.","下品なダウナーメイドの熟成されたムレムレ肉布団で超密着濃厚汗だくえっち","4->1252224.jpg","314->パッケージイラスト(ロゴ無し).png","105->01.プロローグ.mp3/105->02.口臭をたっぷり嗅がされながらオナサポ乳首責め.mp3/105->03.ぬるぬるで汗臭い体を抱きしめながら腹コキ.mp3/105->04.メス臭い愛液ローションで耳舐め手コキ.mp3/105->05.熟成されたムレムレ肉布団で超密着濃厚汗だくえっち.mp3/105->06.エピローグ.mp3",""
52340,RJ285314,"145","10-29-3-17-114-6-8","102","Mát-xa dầu toàn thân trơn trượt, gợi cảm của phụ nữ đã kết hôn ~ Dịch vụ dầu đặc từ một người phụ nữ đã kết hôn ngực khủng, kín đáo dâm đãng. Trải nghiệm bí mật tại một cơ sở cấm quan hệ tình dục ~ [ASMR tình dục với dầu]","全身ぬるぬる人妻性感オイルマッサージ～巨乳隠れビッチ人妻の濃厚オイルサービス→本番禁止のお店でこっそり味見～【オイル風俗ASMR】","4->285314.jpg","315->hitodumaoil5 2400.jpg","141->０　入店　オイルマッサージ(囁きMAX盛り seあり).mp3/141->１　耳オイルパイズリ→オイル耳責め(囁き盛り seあり).mp3/141->２　オイルパイズリ＆お掃除フェラ（囁き盛り seあり）.mp3/141->３　全身性感オイルマッサージ(囁きMAX盛り seあり).mp3/141->４　誘惑オイルスマタ→お店と旦那には【秘密のサービス】(囁き seあり).mp3/316->５　シャワーを浴びながらキス手コキ→耳舐め「スマタ」（囁き盛り seあり ver）.mp3",""
128711,RJ01312058,"4","7-15-54-62-30-5","103","Phương pháp điều trị thủ dâm “hơi nghiêm khắc” của Phòng khám Xuất tinh","射精診療科の“ちょっと厳し目の”手コキ寸止め治療","4->1312058.jpg","227->image.png","227->射精診療科の_ちょっと厳し目の_手コキ寸止め治療.mp3",""
97078,RJ01072769,"6","29-45-58-17-18-54-8-16","104","Mút lưỡi","ベロチューイーツ【バイノーラル】","4->1072769.jpg","317->イメージイラスト.jpg","71->0.プロローグ.mp3/71->1.『あたしのオススメの味でいい？』.mp3/71->2.『ちょっと変態チックなオプションだね。ふふ』.mp3/71->3.『唇と……お耳に、たっぷりキスしてあげるからね』.mp3/71->4.『お兄さん、あたしのおっぱい、たまに見てたしね』.mp3/71->5.『……オススメの“特別裏オプション”、する？』.mp3/71->6.おまけ『また、ベロチュー手コキ、する？』.mp3",""
109387,RJ01141816,"3","35-11-17-18-144-69-126-123-24","","Chơi trò yêu đương với cô bạn trầm tính","【限定版】ダウナーな君と恋人ごっこ","4->1141816.jpg","228->01_ジャケットイラスト ロゴ無し.png/228->02_ジャケットイラスト(背景透過).png","106->00_プロローグ.mp3/106->01_「声、すっごい出ちゃってるね…喘ぎ声って、男の子も出すもんなんだ。」.mp3/106->02_「あたし、初めてだったのに…だから……また、しよ。」.mp3/106->03_「水着、ずらして……ほら……。おっぱい、見せたげる。」.mp3/106->04_「まるで……あたし……。キミのこと、ホントに……。」.mp3/106->05_「早くキミに、いっぱい気持ちよくして欲しくって……うずうず、止まんない……っ。」.mp3",""
114244,RJ01173411,"33-6","10-35-45-32-17-18-105-37-22-16","","Thần tượng học đường chuyên bắt nạt bạn bị cô hầu gái xinh đẹp biến thành nô lệ tình dục, từ đó cuộc sống tình dục ngọt ngào với harem bắt đầu.","【あまあま×ハーレム】アナタをいじめる現役アイドルJKがクールメイドにオナホ奴○化させられちゃって、あまあまハーレム性活が始まっちゃうお話","4->1173411.jpg","229->パッケージイラスト【ロゴなし】.jpg/229->購入特典.jpg","72->01：プロローグ♪.mp3/72->02：現役JKアイドル壁尻に無許可中出し♪.mp3/72->03：クールメイドの現役JKアイドルオナホ奴隷化調教♪.mp3/72->04：クールメイドとオナホ奴隷の奪い合いハーレムフェラチオ♪.mp3/72->05：わんちゃんコスしたオナホ奴隷と本気野外交尾withクールメイド♪.mp3/72->06：クールメイドの嫉妬心丸出し種搾りプレスwithオナホ奴隷のアナル舐めサポート♪.mp3/72->07：全裸で密着妊娠報告withダブルべろちゅーハーレム手コキ♪.mp3",""
112855,RJ01171467,"146","29-45-15-74-19-54-22-16-73","105","“Phương pháp thụ thai thần tượng”: Thụ thai cho thần tượng JK dễ thương và ngây thơ mà bạn yêu thích nhất","“アイドル妊娠法”で子作り孕ませ推奨の、クールで無垢なJKおまんこアイドル【バイノーラル】","4->1171467.jpg","230->イメージイラスト_表情差分.jpg/230->イメージイラスト.jpg","73->0.プロローグ.mp3/73->1.『最初は、手でするのがいいんだって』.mp3/73->2.『今日からおまんこしよっか』.mp3/73->3.『今日はいよいよ、子作り本番えっちです』.mp3/73->4.『わたしのライブ映像見ながらおまんこする？』.mp3/73->5.『ラブホで子作りおまんこしよっか』.mp3/73->6.おまけ『お兄さんの好きな淫語、録音してあげる』.mp3",""
126682,RJ01282001,"4","1-81-83-101-84-102-52-85","","Sự sa ngã của cô gái phép thuật mạnh nhất - Misty Holia ~Sự sa ngã của cô em gái ruột~","最強魔法少女ミスティホーリアの陥落～実妹悪堕計画～","4->1282001.jpg","186->サムネ文字無し.PNG/186->第5フェイズ.PNG/186->立ち絵文字無し.PNG","74->1.FIRST PHASE.m4a/74->2.HYPNO PHASE.m4a/74->3.BRAINWASH PHASE.m4a/74->4.NEGATIVE PHASE.m4a/74->5.CORRPUPT PHASE.m4a/74->6.REINCARNATION PHASE.m4a/74->7.DARKNESS PHASE.m4a",""
128703,RJ01308666,"142","29-1-89-25-37-119-76-9-30-73-24-5","106","Bài học sau giờ học với cô nàng cổ động viên ngực khủng Chie Aizawa ♪","巨乳チアガールの愛沢千恵に迫られる放課後レッスン♪【あまあま×寝取りJK】","4->1308666.jpg","318->【イラスト・タイトルロゴなし】チア部JK.jpg/231->PC用.jpg/231->スマホ用.jpg","187->チアJK１(SEあり).m4a/187->チアJK２(SEあり).m4a/187->チアJK３(SEあり).m4a/107->０．システムメッセージ(通し).m4a/107->１．メール着信・受信.m4a/107->２．ゴミ箱を空に.m4a/107->３．エラーメッセージ.m4a/107->４．起動.m4a/107->５．終了.m4a",""
127729,RJ01302846,"6","125-36-46-59-25-38-55-20-98-16-73-43-24","","A school life filled with love and a ruthless busty devil who can destroy the world if she so desires","その気になれば世界を滅ぼせる冷酷な巨乳悪魔と愛に満ち溢れた学校性活","4->1302846.jpg","319->パッケージイラスト(ロゴ無し).png","108->01.プロローグ.m4a/108->02.メスの匂いと味を体に叩き込まれながら乳首責め手コキ.m4a/108->03.汗臭い体臭の雑魚マン悪魔と抱きつき交尾.m4a/108->04.学級閉鎖中に乳首責めフェラチオ.m4a/108->05.恐怖と快感に狂わされて理性崩壊汗だく交尾.m4a/108->06.世界を滅ぼしながら愛を深める純愛交尾.m4a",""
125142,RJ01268787,"6","35-36-83-25-47-38-84-16-43-24","","A dirty sister who lets me use her dirty dick hole freely and has a lazy, groaning sex session at home","下品なチンコキ穴を自由に使わせてくれるダウナー汚姉ちゃんとおうちでだらだらオホ声えっち","4->1268787.jpg","320->パッケージイラスト(ロゴ無し).png","75->01.プロローグ.m4a/75->02.メス臭い体に抱きつかれて太ももコキ.m4a/75->03.くっさい愛液ローションで耳舐め手コキ.m4a/75->04.臭いおっぱいでパイズリしながらチンカスお掃除フェラチオ.m4a/75->05.ほかほかのくさマンで理性崩壊オホ声えっち.m4a/75->06.お互いの汗を染み込ませながらオホ声えっち.m4a/75->07.ダウナー汚姉ちゃんとおうちでだらだらオホ声えっち.m4a",""
99926,RJ01087361,"29","29-1-11-15-17-18-54-117-25-8-24-5","107","A freshly erect penis ~A nun who absolutely wants to make him cum vs a hero who absolutely doesn’t want to cum~","【禁欲解禁どすけべシスターに射精するまで攻められる】ちんぽこたてたて ～絶対イかせたいシスター vs 絶対イきたくない主人公～","4->1087361.jpg","321->高画質パッケージ.png","142->01.女神に蘇生されたけど、とんでもないことを言われた….m4a/142->02.Round1：耳元囁き発情手コキ＆耳舐め.m4a/142->03.Round2：寝起き性処理フェラ＆乳圧パイズリフェラ.m4a/142->04.Round3：発情ディープキス＆禁欲解放オホ声セックス.m4a/142->05.Round4：もはや我慢できるわけがないドスケベ全力えっち.m4a",""
123535,RJ01251665,"6","104-36-17-59-25-38-55-20-16-43-24","","A downer-type, mentally unstable high school girl is wrapped in a futon of plump flesh that is permeated with a strong female smell and has a super close and intense moaning sound.","ダウナー系メンヘラJKの強烈なメス臭が染み込んだムチムチ肉布団に包まれて超密着濃厚オホ声えっち","4->1251665.jpg","322->パッケージイラスト(ロゴ無し).png","109->01.プロローグ.m4a/109->02.強烈な腋汗ローションで背面乳首責め手コキ.m4a/109->03.布団に潜って汗だく乳首責めフェラチオ.m4a/109->04.ホカホカで汗臭い肉布団に抱きついて超密着濃厚オホ声えっち.m4a/109->05.強烈なメス臭が染み込んだムチムチ肉布団に包まれて超密着濃厚オホ声えっち.m4a/109->06.エピローグ.m4a",""
126466,RJ01286566,"6","35-11-36-83-25-47-38-84-16-43-24","","Having intimate and passionate sex with my slovenly and untidy big sister (33 years old) in a dirty room filled with the smell of lustful body odor","クズでだらしないダウナーお姉ちゃん(33歳)と下品な体臭が充満している汚部屋で超密着濃厚オホ声えっち","4->1286566.jpg","323->パッケージイラスト(ロゴ無し).jpg","110->01.プロローグ.wav/110->02.汗臭い体を密着させて耳舐め手コキ.wav/110->03.ねっとり濃厚おしゃぶりフェラチオ.wav/110->04.下品な体臭が充満している汚部屋で超密着濃厚オホ声えっち.wav/110->05.ドスケベな体臭を漂わせて超密着濃厚オホ声えっち.wav/110->06.エピローグ.wav",""
127011,RJ01281489,"6","104-35-125-11-36-17-25-38-16-43-24","","A super close and intense o-ho voice sex with a shut-in downer demon king in a futon permeated with a vulgar lewd smell","引きこもりのダウナー魔王と下品な淫臭が染み込んだ布団の中で超密着濃厚オホ声えっち","4->1281489.jpg","324->パッケージイラスト(ロゴ無し).png","111->01.プロローグ.m4a/111->02.強烈な腋汗ローションで耳舐め手コキ.m4a/111->03.ぬるぬるでポヨポヨのお腹で腹コキ.m4a/111->04.下品な淫臭が染み込んだ布団の中で超密着濃厚オホ声えっち.m4a/111->05.ムチムチのでっかい体に抱きつかれて超密着濃厚オホ声えっち.m4a/111->06.エピローグ.m4a",""
120511,RJ01221507,"19","10-29-45-11-33-54-90-16-5","","Your personal onahole JK-chan will love you and and get you pregnant♪","【JKオナホ強○令】あなただけのオナホJKちゃんとずぅ～っとラブラブ孕ませ懇願エッチ♪","4->1221507.jpg","232->高解像度イラスト.jpg/232->高解像度立ち絵イラスト.jpg","30->【01】ひまり、先輩が自慢できるような立派なオナホールになりますね♪.m4a/30->【02】せ～んぱい♪オナホご奉仕のお時間ですよ♪.m4a/30->【03】ひまりの秘密兵器でハーレム耳舐めご奉仕です♪.m4a/30->【04】先輩！おちんぽ特訓のお時間ですよ♪.m4a/30->【05_v1】ひまりのおまんこ、いっぱいペロペロしてくださいね♪_ねっとり耳舐め.m4a/30->【05_v2】ひまりのおまんこ、いっぱいペロペロしてくださいね♪_れろれろ耳舐め.m4a/30->【05_v3】ひまりのおまんこ、いっぱいペロペロしてくださいね♪_耳キス.m4a/30->【06】ひまりのオナホおまんこで気持ちよくなってください♪.m4a/30->【07】ひまりのエッチな囁き、耳元でいっぱい聴いてください♪_淫語塗れのドスケベ耳舐めループ.m4a/325->【08】キスループ.m4a/188->【09】吐息交じりの両耳キスループ.m4a/188->【10】舌先れろれろ両耳舐めループ.m4a/188->【11】ねっとり両耳舐めループ.m4a/233->【12】可愛くてエッチな喘ぎ声ループ.m4a/233->【13】オホ喘ぎループ.m4a/112->【14】両耳キス＋可愛い喘ぎ声.m4a/112->【15】舌先れろれろ両耳舐め＋可愛い喘ぎ声.m4a/112->【16】ねっとり両耳舐め＋可愛い喘ぎ声.m4a/112->【17】両耳キス＋オホ喘ぎ声.m4a/112->【18】舌先れろれろ両耳舐め＋オホ喘ぎ声.m4a/112->【19】ねっとり両耳舐め＋オホ喘ぎ声.m4a/326->【EX】耳元で囁かれながらひまりちゃんとオホ声オナホエッチ♪.m4a",""
131719,RJ01347873,"119","29-86-92-3-6-88-8","94","Cheating off-line with a frustrated busty housewife cosplayer and her favorite character cosplay","[スタジオレイン] 欲求不満な爆乳人妻レイヤーと推しキャラコスプレ浮気オフパコ","4->1347873.jpg","234->コスプレ人妻_ロゴなし.jpg/234->コスプレ人妻_正方形.jpg","170->(1).プロローグ.m4a/170->(2)推しキャラにえっちな奉仕をされる気分はどうですか？.m4a/170->(3).今の私はカレンなので中出しセックスしても浮気になりません.m4a/170->(4).エピローグ.m4a",""
131787,RJ01362071,"33","10-1-156-37-44","108","A blowjob-specializing penis massage parlor that gives you the best blowjobs 1","極上のフェラ抜きをしてくれるフェラ専門チンポエステ店 1","4->1362071.jpg","235->モザイク版.jpg/235->黒修正版.jpg","143->1.フェラエステ店 サービス説明.m4a/143->2.舌の動きが凄い亀頭攻めフェラ.m4a/143->3.涎たっぷりのフェラ.m4a/143->4.極上のヌキフェラ.m4a/143->おまけ 舌の動きが凄い亀頭舐め抜粋.m4a",""
131138,RJ01355818,"3","29-1-17-37-22-55-21","","The story of how I seduced and impregnated the always noisy discipline committee member with raw sex","【オホ声】いつもうるさい風紀委員を生ハメSEXで堕とし孕ませた話","4->1355818.jpg","327->表紙.jpg","76->Track01.m4a/76->Track02.m4a/76->Track03.m4a/76->Track04.m4a/76->Track05.m4a/76->Track06.m4a/76->Track07.m4a",""
130719,RJ01333366,"41","10-1-100-87-11-36-17-59-25-37-9-24","28","Reverse Bunny’s Loud Mouth Fucking ~A dirty mouth pussy that attacks with the intention of impregnating you through the throat~","【フェラ特化】逆バニーの爆音お口交尾 ～喉から孕むつもりで攻めてくる下品な口ま●こ～《早期購入特典:ボーナストラック含む豪華3大特典!》","4->1333366.jpg","328->高画質イラスト.png","77->tr00_タイトルコール.m4a/77->tr01_導入～逆バニーと個室で呑めるバー～.m4a/77->tr02_お口交尾です.m4a/77->tr03_バキュームフェラです♪.m4a/77->tr04_ここからが本当のお口交尾です♪.m4a/77->tr05_フェラチオフルコース♪.m4a/77->tr06_最後はおまんこでもご褒美♪.m4a",""
130556,RJ01344347,"3","11-17-25-37-8-21-9-28-69-24","","[Teacher x Student] Sweet and obsessive sex with a student who refuses school","【先生×教え子】豪華5大特典共依存 -不登校ダウナー教え子と甘オホ執着セックス-","4->1344347.jpg","329->♡高画質パッケージイラスト♡.jpg","49->00.突然の家庭訪問.m4a/49->01.秘密。発情トラップとキスコキ射精.m4a/49->02.依存の始まり。罪悪感の生ハメセックス.m4a/49->03.2度目の訪問。抗えない快楽と即尺.m4a/49->04.快楽の証。欲望の連続絶頂連続中出し.m4a/49->05.××日ぶりの登校。教室で耳舐め手コキと勃起フェラ.m4a/49->06.背徳のスパイス。誰かの視線と教室セックス.m4a/49->07.突然の逆訪問。堕落共依存セックスとパイズリフェラ.m4a/236->じゅぽじゅぽフェラ♡ループ.m4a/236->れるれる耳舐め手コキ♡ループ.m4a",""
